{
  "schema_version": "observatory-annotation-v1",
  "taxonomy_version": "1.0.0",
  "generated_at": "2026-03-15T10:00:00+00:00",
  "annotator": {
    "type": "manual",
    "identity": "observatory-exemplar-author"
  },
  "annotations": [
    {
      "task_id": "locobench_c_api_graphql_expert_079",
      "trial_path": "runs/official/_raw/csb_locobench_sonnet_20260312/baseline/2026-03-12__18-00-00/locobench_c_api_graphql_expert_079__a1b2c3d",
      "reward": 0.0,
      "passed": false,
      "categories": [
        {
          "name": "task_ambiguity",
          "confidence": 0.9,
          "evidence": "Task said 'optimize the database query'. Agent added an index and rewrote the query with a JOIN. Verifier expected only the index addition. Agent's solution was arguably better but scored 0 because test checked for original query structure."
        }
      ],
      "benchmark": "locobench",
      "model": "anthropic/claude-sonnet-4-6",
      "config_name": "baseline",
      "notes": "Exemplar: ambiguous task specification allowed multiple valid interpretations.",
      "annotated_at": "2026-03-15T10:00:00+00:00"
    }
  ]
}
