{
  "schema_version": "observatory-annotation-v1",
  "taxonomy_version": "1.0.0",
  "generated_at": "2026-03-15T10:00:00+00:00",
  "annotator": {
    "type": "manual",
    "identity": "observatory-exemplar-author"
  },
  "annotations": [
    {
      "task_id": "swebench_lite_scikit_learn__scikit_learn-25570",
      "trial_path": "runs/official/_raw/csb_swebench_sonnet_20260310/baseline/2026-03-10__22-00-00/scikit_learn__scikit_learn-25570__d4e5f6a",
      "reward": 1.0,
      "passed": true,
      "categories": [
        {
          "name": "success_via_commit_context",
          "confidence": 0.9,
          "evidence": "Agent ran 'git log --oneline -20' and 'git blame sklearn/utils/validation.py' to understand why a particular validation pattern was used. The blame output revealed a recent refactor commit, and the agent's fix followed the same pattern. has_git_tools=true."
        }
      ],
      "benchmark": "swebench_lite",
      "model": "anthropic/claude-sonnet-4-6",
      "config_name": "baseline",
      "notes": "Exemplar: git blame provided crucial context about the intended design pattern.",
      "annotated_at": "2026-03-15T10:00:00+00:00"
    }
  ]
}
