{
  "schema_version": "observatory-annotation-v1",
  "taxonomy_version": "1.0.0",
  "generated_at": "2026-03-15T10:00:00+00:00",
  "annotator": {
    "type": "manual",
    "identity": "observatory-exemplar-author"
  },
  "annotations": [
    {
      "task_id": "swebench_lite_matplotlib__matplotlib-23476",
      "trial_path": "runs/official/_raw/csb_swebench_sonnet_20260310/baseline/2026-03-10__23-00-00/matplotlib__matplotlib-23476__e0f1a2b",
      "reward": 1.0,
      "passed": true,
      "categories": [
        {
          "name": "insufficient_provenance",
          "confidence": 0.9,
          "evidence": "Agent achieved reward=1.0 with only 4 tool calls: 1 file read and 3 edits. No search or navigation tools were used. It is unclear how the agent knew which files to edit."
        }
      ],
      "benchmark": "swebench_lite",
      "model": "anthropic/claude-sonnet-4-6",
      "config_name": "baseline",
      "notes": "Exemplar: correct solution but the reasoning trace is opaque. Possible memorization or strong prior knowledge.",
      "annotated_at": "2026-03-15T10:00:00+00:00"
    }
  ]
}
