{
  "schema_version": "observatory-annotation-v1",
  "taxonomy_version": "1.0.0",
  "generated_at": "2026-03-15T10:00:00+00:00",
  "annotator": {
    "type": "manual",
    "identity": "observatory-exemplar-author"
  },
  "annotations": [
    {
      "task_id": "locobench_org_migration_091",
      "trial_path": "runs/official/_raw/csb_locobench_sonnet_20260312/baseline/2026-03-12__16-00-00/locobench_org_migration_091__a7b8c9d",
      "reward": 1.0,
      "passed": true,
      "categories": [
        {
          "name": "success_via_decomposition",
          "confidence": 0.9,
          "evidence": "Agent decomposed a new-API-endpoint task into: (1) create migration, (2) add model, (3) write serializer, (4) implement view, (5) add URL route. Five files edited in correct dependency order. Trajectory shows deliberate planning before first edit."
        }
      ],
      "benchmark": "locobench",
      "model": "anthropic/claude-sonnet-4-6",
      "config_name": "baseline",
      "notes": "Exemplar: correct decomposition of a complex multi-file task into ordered steps.",
      "annotated_at": "2026-03-15T10:00:00+00:00"
    }
  ]
}
