{
  "schema_version": "observatory-annotation-v1",
  "taxonomy_version": "1.0.0",
  "generated_at": "2026-03-15T10:00:00+00:00",
  "annotator": {
    "type": "manual",
    "identity": "observatory-exemplar-author"
  },
  "annotations": [
    {
      "task_id": "locobench_game_engine_045",
      "trial_path": "runs/official/_raw/csb_locobench_haiku_20260308/baseline/2026-03-08__21-30-00/locobench_game_engine_045__d9e0f1a",
      "reward": 0.2,
      "passed": true,
      "categories": [
        {
          "name": "minimal_progress",
          "confidence": 0.9,
          "evidence": "Reward=0.2 — agent set up BFS data structures correctly but left visited-node tracking incomplete, causing infinite loops on cyclic graphs. 1 of 5 test cases passed."
        }
      ],
      "benchmark": "locobench",
      "model": "anthropic/claude-haiku-4-5-20251001",
      "config_name": "baseline",
      "notes": "Exemplar: agent understood the problem partially but implementation was too incomplete to be useful.",
      "annotated_at": "2026-03-15T10:00:00+00:00"
    }
  ]
}
