{
  "schema_version": "observatory-annotation-v1",
  "taxonomy_version": "1.0.0",
  "generated_at": "2026-03-15T10:00:00+00:00",
  "annotator": {
    "type": "manual",
    "identity": "observatory-exemplar-author"
  },
  "annotations": [
    {
      "task_id": "locobench_cross_file_refactoring_088",
      "trial_path": "runs/official/_raw/csb_locobench_sonnet_20260312/sourcegraph_full/2026-03-12__15-30-00/locobench_cross_file_refactoring_088__c7d8e9f",
      "reward": 1.0,
      "passed": true,
      "categories": [
        {
          "name": "success_via_code_nav",
          "confidence": 0.9,
          "evidence": "Agent used find_references to discover all 5 callers of the deprecated method. has_code_nav_tools=true."
        },
        {
          "name": "success_via_local_exec",
          "confidence": 0.6,
          "evidence": "After editing, agent ran 'pytest tests/ -x' twice to verify. edit_verify_cycles=2 with final success."
        },
        {
          "name": "success_via_decomposition",
          "confidence": 0.6,
          "evidence": "Agent planned the refactoring order: (1) update interface, (2) update implementations, (3) update callers, (4) run tests. Executed in sequence."
        }
      ],
      "benchmark": "locobench",
      "model": "anthropic/claude-sonnet-4-6",
      "config_name": "sourcegraph_full",
      "notes": "Exemplar: multiple success strategies combined. Code navigation, local execution, and decomposition all contributed.",
      "annotated_at": "2026-03-15T10:00:00+00:00"
    }
  ]
}
