{
  "schema_version": "observatory-annotation-v1",
  "taxonomy_version": "1.0.0",
  "generated_at": "2026-03-15T10:00:00+00:00",
  "annotator": {
    "type": "manual",
    "identity": "observatory-exemplar-author"
  },
  "annotations": [
    {
      "task_id": "locobench_cross_file_refactoring_038",
      "trial_path": "runs/official/_raw/csb_locobench_sonnet_20260312/baseline/2026-03-12__14-45-00/locobench_cross_file_refactoring_038__f3a4b5c",
      "reward": 0.4,
      "passed": true,
      "categories": [
        {
          "name": "incomplete_solution",
          "confidence": 0.9,
          "evidence": "Reward=0.4 — agent fixed quoted field handling in the CSV parser (2 of 5 test cases pass) but did not address escaped commas or multiline values."
        }
      ],
      "benchmark": "locobench",
      "model": "anthropic/claude-sonnet-4-6",
      "config_name": "baseline",
      "notes": "Exemplar: partial solution that addressed the most obvious case but missed edge cases.",
      "annotated_at": "2026-03-15T10:00:00+00:00"
    }
  ]
}
