{
  "schema_version": "observatory-annotation-v1",
  "taxonomy_version": "1.0.0",
  "generated_at": "2026-03-15T10:00:00+00:00",
  "annotator": {
    "type": "manual",
    "identity": "observatory-exemplar-author"
  },
  "annotations": [
    {
      "task_id": "locobench_game_engine_071",
      "trial_path": "runs/official/_raw/csb_locobench_sonnet_20260312/baseline/2026-03-12__20-00-00/locobench_game_engine_071__c0d1e2f",
      "reward": 0.0,
      "passed": false,
      "categories": [
        {
          "name": "over_exploration",
          "confidence": 0.9,
          "evidence": "tool_calls_total=247, corpus mean=45 (sigma=30). 247 > 105 (mean+2*sigma). Agent read 89 distinct files and ran 31 searches but made only 2 edits. Wall clock time: 58 minutes (near timeout)."
        }
      ],
      "benchmark": "locobench",
      "model": "anthropic/claude-sonnet-4-6",
      "config_name": "baseline",
      "notes": "Exemplar: agent explored the repository extensively without forming a coherent strategy.",
      "annotated_at": "2026-03-15T10:00:00+00:00"
    }
  ]
}
